fecha,fuente,titulo,encabezado
25/5/2020,Voz de América,Buenos Días América: 05/25/20 | Voice of America - Spanish,TV en Vivo. Vea en directo: Funeral de George Floyd desde Houston thumbnail. VOA Spanish TV. Vea en directo: Funeral de George Floyd desde Houston.
26/5/2020,USA TODAY,What we know about the death of George Floyd: 4 Minneapolis police officers fired after 'horrifying' video hits social media,What we know about the death of George Floyd: 4 Minneapolis police officers fired after 'horrifying' video hits social media. Jordan Culver. USA TODAY.
26/5/2020,WCCO | CBS Minnesota,‘I Can’t Breathe!’: Video Of Fatal Arrest Shows Minneapolis Officer Kneeling On George Floyd’s Neck For Several Minutes,George Floyd deserved better and his family deserves justice. His life mattered. I'm grateful for the swift action in Minneapolis to fire the officers involved — they ...
26/5/2020,NPR,FBI Investigating Death Of Black Man Pinned To Ground By Police Officer,The man has been identified as George Floyd by the mayor and by Benjamin Crump a prominent civil rights attorney who says he has been retained by Floyd's ...
26/5/2020,KSTP,'I want people to remember him that way': Boss of George Floyd says he was a 'calm nice guy',5 EYEWITNESS NEWS is learning more about George Floyd from those who knew him. Floyd worked as a security guard at a local bistro in Minneapolis.
26/5/2020,CBS Chicago,Protest Held In Chicago After Death Of George Floyd During Arrest By Minneapolis Police,Michigan Ave. in solidarity with people in Minneapolis following the death of George Floyd. “This organized protest isn't a direct diss to CPD. It's not a diss to you ...
26/5/2020,KARE11.com,Reactions to the death of George Floyd,Social media posts and statements are lamenting the loss of the man identified by his attorney as George Floyd but those reactions are also expressing anger ...
26/5/2020,,,
26/5/2020,Minneapolis Star Tribune,What we know about Derek Chauvin and Tou Thao two of the ...,The Minneapolis police officer shown on video kneeling on George Floyd's neck as Floyd pleaded for help along with another officer who stood by and watched ...
26/5/2020,Voz de América,Buenos Días América: 05/26/20 | Voice of America - Spanish,Vea en directo: Funeral de George Floyd desde Houston thumbnail. VOA Spanish TV. Vea en directo: Funeral de George Floyd desde Houston · En vivo: Trump ...
27/5/2020,CNN,George Floyd's family says four officers involved in his death should be charged with murder,George Floyd's family says four officers involved in his death should be charged with murder. By Christina Maxouris CNN. Updated 5:48 PM ET Wed May 27 ...
27/5/2020,Associated Press,Victim in police encounter had started new life in Minnesota,... officer's knee George Floyd was suffering the same fate as millions of Americans during the coronavirus pandemic: out of work and looking for a new job.
27/5/2020,BuzzFeed News,Friends Say George Floyd Always Went Out Of His Way To Help People Who Were Less Fortunate,Floyd 46 died in police custody on Monday after a white police officer pushed his knee into his neck on the ground outside a supermarket in Minneapolis. Video ...
27/5/2020,KARE11.com,'Everybody loved Floyd': Remembering George Floyd,MINNEAPOLIS Minnesota — While George Floyd's name became known to the world for his last moments on Earth friends and family are remembering all the ...
27/5/2020,NBC News,'Justice will be served!': Trump weighs in on George Floyd case,': Trump weighs in on George Floyd case. Floyd 46 died Monday night after a Minneapolis police officer pinned him by the neck with his knee for more than eight ...
27/5/2020,KSTP,Peaceful demonstrations continue outside Cup Foods where George Floyd died,38th Street and Chicago Avenue where George Floyd died. The community shared pain grief and anger toward the Minneapolis Police Department.
27/5/2020,The Commercial Appeal,'Stop killing black people': Demonstration closes Union Avenue as protesters face off with counter-protesters MPD,A silent demonstration Wednesday intended to protest the deaths of George Floyd Breonna Taylor and Ahmaud Arbery turned into separate verbal ...
27/5/2020,G1,Caso George Floyd: morte de homem negro filmado com policial branco com joelhos em seu pescoço causa indignação nos EUA,FBI investiga morte em Minneapolis; vídeo filmado por testemunha mostra George Floyd de 40 anos imobilizado no chão dizendo 'não consigo respirar' ...
27/5/2020,Associated Press,Four Minneapolis officers fired after death of black man,... apologized Tuesday to the black community for the officer's treatment of the man who was later identified as 46-year-old George Floyd who worked security at ...
27/5/2020,KPRC Click2Houston,Community gathers to grieve death of George Floyd in Houston,The community center has been a home away from home for Spivey since his childhood — back when he and friend George Floyd would play pickup football ...
27/5/2020,WCCO | CBS Minnesota,MFD Incident Report: Medics Worked On ‘Unresponsive Pulseless’ George Floyd After Mpls. Arrest,MFD Incident Report: Medics Worked On 'Unresponsive Pulseless' George Floyd After Mpls. Arrest. Incident Report Describes Confusion As Fire Crew Arrived At ...
27/5/2020,CNN,New surveillance video shows moments leading up to George Floyd's arrest,New surveillance video shows moments leading up to George Floyd's arrest. Four Minneapolis police officers have been fired for their involvement in the death ...
27/5/2020,Minnesota Public Radio News,George Floyd's sister: 'They murdered my brother. They killed him.',George Floyd died after being detained by Minneapolis police officers on Monday May 25 2020. Friends and family say he was a supportive and gentle presence.
27/5/2020,Houston Chronicle,Yates football program mourns death of George Floyd gifted athlete and 'ultimate people person',Former Yates High School football and basketball player George Floyd who died in Minneapolis police custody this week was fondly remembered by former ...
27/5/2020,WCCO | CBS Minnesota,George Floyd’s Death At Hands Of Police Deals Traumatic Blow To Community,MINNEAPOLIS (WCCO) — The replaying of the video of George Floyd taking his last breath while in police custody is jarring to all who see it especially ...
27/5/2020,Tampa Bay Times,George Floyd: Frustration in Tampa Bay after another ‘I can’t breathe’ death,George Floyd: Frustration in Tampa Bay after another 'I can't breathe' death. The man's death following an incident with Minneapolis police hit hard locally even if ...
27/5/2020,WCCO | CBS Minnesota,How Long Do Investigations Like The George Floyd Case Usually Take? Good Question,... MN Commissioner of Public Safety John Harrington said he wants to move along the investigation into the death of George Floyd as quickly as possible.
27/5/2020,KSTP,VIDEO: Compilation of scenes from George Floyd protests interviews with witnesses,KSTP has compiled edited video of scenes from the protests surrounding George Floyd's death happening in south Minneapolis over the past two days.
27/5/2020,CBS Dallas / Fort Worth,Harris County Protests After Texan George Floyd Dies In Police Custody In Minneapolis,Now George Floyd is dead four police officers have been fired and protests are being held in cites across the country. Floyd an unarmed black man died while ...
27/5/2020,bellingcat,The Boogaloo Movement Is Not What You Think - bellingcat,On May 26th crowds gathered in Minneapolis Minnesota to protest the death of 46-year-old George Floyd at the hands of the city's police department. Floyd ...
28/5/2020,AS Usa,¿Quién era George Floyd y por qué fue arrestado por la Policía en Minneapolis?,Un hombre de 46 años llamado George Floyd fue detenido por un oficial al intentar pagar con un billete falso de $20 dólares sin embargo el policía lo terminó ...
28/5/2020,Associated Press,Police experts condemn knee restraint used on George Floyd,Police around the nation and law enforcement experts on Thursday broadly condemned the way George Floyd who died in Minneapolis police custody this ...
28/5/2020,New York Post,Here's everything we know about the death of George Floyd,It was a routine police call for a run-of-the-mill crime — someone passing a bogus $20 bill at a deli. But the ensuing death of unarmed black man George Floyd ...
28/5/2020,KSTP,George Floyd fired officer overlapped security shifts at south Minneapolis club,George Floyd and now-former Officer Derek Chauvin both worked security at the El Nuevo Rodeo club on Lake Street according to Maya Santamaria.
28/5/2020,CNN,Prosecutors do not announce charges in George Floyd's death but say 'justice will be served',Floyd a 46-year-old black man died after pleading for help as a police officer used his knee on Floyd's neck to pin him -- unarmed and handcuffed -- to the ground.
28/5/2020,NPR,Minneapolis Man Who Died In Police Custody Described As 'Gentle Giant',Friends of George Floyd watched in disbelief as the now-viral video played. It shows a handcuffed black man facedown on the street pleading for his life.
28/5/2020,WCCO | CBS Minnesota,‘A Beautiful Spirit:’ George Floyd Made New Life in Minn. But Lost Job Due To Pandemic,MINNEAPOLIS (WCCO) — Before he died after being pinned for minutes beneath a Minneapolis police officer's knee George Floyd was suffering the same fate ...
28/5/2020,NBC News,Mississippi mayor under fire over comments on George Floyd's death,"Mayor Hal Marx of Petal Mississippi said he “didn't see anything unreasonable” in the video of George Floyd's arrest. ""If you can talk you can breathe."" Image: Hal ..."
28/5/2020,USA TODAY,George Floyd.,"Who was George Floyd? Floyd was a 46-year-old black man in Minneapolis known as a ""gentle giant"" to friends and family who say he never made ..."
28/5/2020,The Commercial Appeal,Protesters gather against police brutality for a second night in Memphis,"... of ""Black lives matter"" and ""I can't breathe"" a reference to the death of George Floyd. Floyd died earlier this week after a Minneapolis police officer knelt on his ..."
28/5/2020,NBCSports.com,Wentz addresses George Floyd situation in rare tweet,Been thinking about the George Floyd situation and thinking of the words to say & coming up empty. All I know is that the institutional racism in this country ...
28/5/2020,TMZ,Teen Who Recorded George Floyd Video Traumatized from Backlash,The girl who captured the death of George Floyd at the hands of Minneapolis police on video is not in a good space right now ... and it's all because of hate she's ...
28/5/2020,ESPN,How the Minnesota Timberwolves are responding to the death of George Floyd,After George Floyd died in police custody this week in Minneapolis Saunders listened to one of his African American colleagues describe how he must consider ...
28/5/2020,WEAR,George Floyd mural re-painted on Pensacola's Graffiti Bridge after being defaced,PENSACOLA Fla. -- The George Floyd mural has been re-painted on Pensacola's Graffiti Bridge Thursday afternoon. It was defaced Thursday morning after ...
28/5/2020,ChristianityToday.com,George Floyd Left a Gospel Legacy in Houston | News & Reporting,“George Floyd was a person of peace sent from the Lord that helped the gospel go forward in a place that I never lived in” said Patrick PT Ngwolo pastor of ...
28/5/2020,UC Davis,Chancellor's Statement on George Floyd,These were among the last words spoken by George Floyd as he suffered the same fate under hauntingly similar circumstances in Minneapolis on Monday ...
28/5/2020,,,
28/5/2020,Toledo Blade,652 miles away in Toledo the impact of George Floyd's death ...,To many Toledoans George Floyd's death 652 miles west in Minneapolis is a tragedy that seemingly could have been avoided. “What troubles me and troubles ...
28/5/2020,Daily Mail,George Floyd left Texas prison to start new life in Minneapolis,George Floyd moved to Minneapolis in 2014 for a fresh start after being released from prison in Houston Texas following an arrest for aggravated robbery; Floyd ...
28/5/2020,Sahan Journal,Owner of Cup Foods condemns police killing of George Floyd,The Arab-American owner of Cup Foods whose employees called police about George Floyd after he allegedly tried to pass a counterfeit 20-dollar bill at the ...
28/5/2020,Los Angeles Times,Floyd Arbery and Cooper provide lessons in terror,On most days I choose to be numb. Tuesday I decided to feel. I recognize for some the video of George Floyd's fatal encounter with four Minneapolis police officers ...
28/5/2020,WCCO | CBS Minnesota,Owner Of Cup Foods Where Police First Encountered George Floyd Calls For Justice,... store where police first made contact with George Floyd is speaking out. He says officers were called because of a counterfeit 20 dollar bill Floyd used to buy a ...
28/5/2020,NPR,The Death Of George Floyd Sparks Outrage From Both Sides ...,"The Justice Department says it has made the investigation into George Floyd's death ""a top priority"" after furor over a video depicting a white police officer ..."
28/5/2020,Washington Post,How Amy Cooper and George Floyd represent two versions of racism that black Americans face every day,How Amy Cooper and George Floyd represent two versions of racism that black Americans face every day. A memorial in honor of ...
28/5/2020,USA TODAY,George Floyd video adds to trauma: 'When is the last time you saw a white person killed online?',George Floyd video adds to trauma: 'When is the last time you saw a white person killed online?' Analysis: African Americans face harmful mental health effects ...
28/5/2020,Bay News 9,Allendale Church Pastor Speaks Out on George Floyd Death,— The disturbing footage of George Floyd literally being restrained to death by Minneapolis Police has sparked outrage in many who've seen it including the ...
28/5/2020,Associated Press,George Floyd protesters set Minneapolis police station afire,... forced to abandon as three days of violent protests spread to nearby St. Paul and angry demonstrations flared across the U.S over the death of George Floyd ...
28/5/2020,ELLE.com,George Floyd Could Have Been My Brother,A portrait of George Floyd in Minneapolis. Stephen MaturenGetty Images. When the dead man is a Black man it's as though it matters less ...
28/5/2020,nj.com,After George Floyd white families should talk cops should denounce | Opinion,After George Floyd white families should talk cops should denounce | Opinion. Posted May 28 2020. US-CRIME-RACE. A man holds ...
28/5/2020,Minnesota Public Radio News,Photos: Looting devastates Twin Cities after George Floyd's death,Floyd was the man who died after a Minneapolis police officer knelt on his neck. This was the second night of protest against the killing. Christine T. Nguyen ...
28/5/2020,CBS Los Angeles,Lakers’ LeBron James Expresses Outrage Over George Floyd’s Death,LOS ANGELES (CBSLA) – Lakers star LeBron James took to social media this week to express his anger over the death of George Floyd an unarmed black ...
28/5/2020,Bay News 9,Bay Area Police Chiefs Weigh in on George Floyd Case,— Law enforcement leaders in two Bay area counties are weighing in on what the public knows so far about the death of George Floyd in Minneapolis. What You ...
28/5/2020,KOMO News,Peaceful protest planned in Seattle this weekend after George Floyd's death,Faith leaders and community activists will speak about George Floyd. The black man who died at the hands of a white Minneapolis police officer earlier this ...
28/5/2020,CNN,George Floyd's brother: I'm tired of seeing black men die,George Floyd's brother: I'm tired of seeing black men die. Philonise Floyd the brother of a black man who was killed while in Minneapolis police custody tells ...
28/5/2020,Refinery29,Your Black Colleagues May Look Like They’re Okay — Chances Are They’re Not,Let's cut to the chase. It's been a tough few days...weeks...months. For many people working in the midst of a global pandemic has been difficult. For those of us ...
28/5/2020,Constant Haïti,États-Unis: Révocation de 4 policiers suite au décès de ...,Selon les quatre policiers révoqués l'Afro-américain du nom de George Floyd a été interpelé parce qu'il avait la ressemblance d'un suspect accusé d'avoir ...
28/5/2020,Minneapolis Star Tribune,Small-business owners pick up the pieces after night of rage ...,More than 100 small businesses across Minneapolis were damaged during the protests Wednesday night over the death of George Floyd in police custody said ...
28/5/2020,Esquire.com.gr,Δολοφονία George Floyd: Του έκλεψαν την τελευταία του ανάσα,"George Floyd: «Δεν μπορώ να αναπνεύσω» - Διαδηλώσεις και επεισόδια. powered by glomex. 2:13. ""Το ..."
28/5/2020,Voz de América,Buenos Días América: 05/28/20 | Voice of America - Spanish,TV en Vivo. Vea en directo: Funeral de George Floyd desde Houston thumbnail. VOA Spanish TV. Vea en directo: Funeral de George Floyd desde Houston.
29/5/2020,BBC Mundo,George Floyd: la oleada de protestas por la muerte de un afroestadounidense en custodia policial que llevó a la quema de una comisaría,Minneapolis vivió su tercera noche consecutiva de violencia por la muerte del afroestadounidense George Floyd cuando fue detenido en la calle este lunes.
29/5/2020,New York Times en Español,George Floyd: la maniobra policial que le causó la muerte,Muerte de George Floyd: una técnica policial que ya ha provocado otras tragedias. Los departamentos de policía de Estados Unidos han tratado de erradicar el ...
29/5/2020,Hoy Chicago,Presentan cargos a policía que mató a George Floyd - En Español,MINNNEAPOLIS — Un agente de la policía de Minneapolis que es visto en un video arrodillado sobre el cuello de George Floyd un hombre ...
29/5/2020,The New York Times,Derek Chauvin Charged in Death of George Floyd in Minneapolis,Mr. Chauvin kept his knee planted even as the man George Floyd told all four officers involved in his arrest that he could not breathe. At times Mr. Floyd ...
29/5/2020,NBC News,George Floyd told police he was struggling to breathe before an officer put a knee on his neck,Prosecutors detail the final moments of Floyd's life as he begged for air. Image: Tony L. Clark holds a photo of George Floyd ...
29/5/2020,ABC News,Derek Chauvin had his knee on George Floyd's neck for nearly 9 minutes complaint says,Derek Chauvin the police officer charged with third-degree murder in connection with the death of George Floyd had his knee on Floyd's neck for nearly nine ...
29/5/2020,The Guardian,An athlete a father a 'beautiful spirit': George Floyd in his friends' words,An athlete a father a 'beautiful spirit': George Floyd in his friends' words. People who knew the man killed in a violent police incident say he was an 'always ...
29/5/2020,The New York Times,George Floyd Death: How the Knee-on-Neck Hold Resulted in Tragedy,In the cellphone video of George Floyd's death the arresting officer Derek Chauvin keeps a knee pressed on the back of his neck for about eight minutes until ...
29/5/2020,USA TODAY,Trump says violent Minneapolis protests dishonor George Floyd’s memory Twitter labels ‘shooting’ tweet as ‘glorifying violence’,"""These THUGS are dishonoring the memory of George Floyd and I won't let that happen” Trump tweeted adding that he had spoken to Gov. Tim Walz and told ..."
29/5/2020,NBC News,Minneapolis police precinct burns as George Floyd protests rage; CNN crew arrested,Minneapolis police precinct burns as George Floyd protests rage; CNN crew arrested. Gov. Tim Walz activated the state's National Guard and lawmakers pleaded ...
29/5/2020,CNN,The move used to restrain George Floyd is discouraged by most police. Here's why,(CNN) George Floyd's death has raised new questions about a potentially dangerous method of restraint: the knee-to-neck maneuver. Floyd a 46-year-old black ...
29/5/2020,BBC News,George Floyd: Protesters set Minneapolis police station ablaze,"A police officer was filmed kneeling on the neck of George Floyd 46 despite him saying he could not breathe. President Donald Trump said ""thugs"" were ..."
29/5/2020,WCCO | CBS Minnesota,Unrest After George Floyd’s Death: Violence Spans Twin Cities 3rd Precinct Overtaken & Burned CNN Reporter Arrested,Unrest After George Floyd's Death: Violence Spans Twin Cities 3rd Precinct Overtaken & Burned CNN Reporter Arrested. May 29 2020 at 8:10 am. Filed Under: ...
29/5/2020,CNBC,New York City mayor condemns Minneapolis officers in George Floyd killing,New York City mayor condemns Minneapolis officers in George Floyd killing. Published Fri May 29 202011:16 AM EDT Updated Fri May 29 20201 ...
29/5/2020,WDEL 1150AM,Protests over George Floyd's death scheduled in Wilmington ...,Protests continued following the death of George Floyd who died after being restrained by Minneapolis police officers on Memorial Day. (AP Photo/Julio Cortez).
29/5/2020,Associated Press,Columbus protest over George Floyd's death turns violent,COLUMBUS Ohio (AP) — Protesters angry over the death of George Floyd in Minneapolis police custody turned out for a demonstration in Columbus that ...
29/5/2020,Los Angeles Times,Omar Jimenez arrest during George Floyd protest unites press,Jimenez and his crew were in Minneapolis covering the violent protests over the killing of George Floyd the 46-year-old African American man who died after a ...
29/5/2020,The Detroit News,Man shot dead dozens arrested as protest in Detroit turns violent,"""George Floyd's death in the deaths of many others — Ahmaud Arbery Trayvon Martin Renisha McBride — they are not isolated incidents but they're a part of a ..."
29/5/2020,WBEZ,Conservative Chicago Police Union President Joins Those Condemning Officer Who Killed George Floyd In Minneapolis,... condemning the actions of the Minneapolis police officer who killed George Floyd. Floyd died Monday after Minneapolis Police Officer Derek Chauvin knelt on ...
29/5/2020,Texas Tribune,Texas elected leaders condemn the death of George Floyd as “horrific”,Texas elected leaders condemn the death of George Floyd as “horrific” “senseless”. In a TV interview Friday Gov. Greg Abbott said said that the death of Floyd a ...
29/5/2020,NBC News,Mississippi mayor ignores calls to resign over comments on George Floyd's death,"Mississippi mayor ignores calls to resign over comments on George Floyd's death. ""What I said came out in a way that I wish I said it differently"" Hal Marx said at a ..."
29/5/2020,NBCSports.com,Kap starts fund to pay lawyers for Minneapolis protesters,Ex-49ers quarterback Colin Kaepernick is raising money for defense lawyers to represent people arrested while protesting in Minneapolis in the wake of George ...
29/5/2020,KSHB,KC's 'passionate' protest of George Floyd's killing moves to ...,The protests were in response to George Floyd's death in police custody Monday in Minneapolis.
29/5/2020,DesMoinesRegister.com,Hundreds expected to attend Des Moines rallies in honor of George Floyd,Hundreds of people were expected to attend multiple Des Moines rallies over the weekend honoring George Floyd a black man who died Monday during an ...
29/5/2020,CNN,Madonna posted a video tribute to George Floyd and it didn't go down well,"She wrote in the caption: ""Brutal murder travels around the world my son David Dances to honor and pay tribute to George and His Family and all Acts of Racism ..."
29/5/2020,,,
29/5/2020,WWBT NBC12 News,Richmond leaders speak out on George Floyd’s death; peaceful events planned for weekend,Protests and outrage have ignited across the country as many demand action in the death of George Floyd who died after a white police officer in Minneapolis ...
29/5/2020,BBC Mundo,Muerte de George Floyd: detienen y acusan de homicidio a Derek Chauvin el expolicía que puso su rodilla sobre el cuello del afroestadounidense,Muerte de George Floyd: detienen y acusan de homicidio a Derek Chauvin el expolicía que puso su rodilla sobre el cuello del afroestadounidense. Redacción ...
29/5/2020,CNN,George Floyd and Derek Chauvin once worked overlapping security shifts at the same nightclub,(CNN) George Floyd and the former Minneapolis police officer seen in a video with his knee on Floyd's neck before he died worked at the same nightclub ...
29/5/2020,The Mercury News,California prison staff posted ‘racist’ and ‘extremely hurtful’ comments about George Floyd’s killing CDCR secretary says,“In the aftermath of the tragic death of George Floyd in Minneapolis it has come to my attention that some employees of this department have taken to social media ...
29/5/2020,The Advocate,After George Floyd's death Joe Burrow says black community has been 'unheard for far too long',Joe Burrow took to Twitter on Friday to weigh in the death of George Floyd urging his fans to open their ears and listen to the painful experiences that many ...
29/5/2020,WOWT,George Floyd protest in Omaha: Arrests made stores ...,... traveled intersection at 72nd and Dodge streets in Omaha on Friday evening for what began as a peaceful protest of the death of George Floyd in Minneapolis ...
29/5/2020,NBC News,Minneapolis police chief faces new test after George Floyd death,The Minneapolis police chief thrust into the spotlight by the George Floyd killing was promoted to his post after another racially charged death that involved an ...
29/5/2020,WFLA,George Floyd protests scheduled throughout the Tampa Bay area this weekend,(WFLA)- Pain and outrage continue to spread throughout the country in response to the death of George Floyd. Floyd a black man died on Monday while being ...
