fecha,fuente,titulo,encabezado
29/5/2020,Wall Street Journal,Twitter Flags Trump Tweet About George Floyd Protests for ‘Glorifying Violence’,Twitter Flags Trump Tweet About George Floyd Protests for 'Glorifying Violence'. President's post can now be seen only after users click box with notice saying it ...
29/5/2020,Rochester Democrat and Chronicle,Opinion: George Floyd's death shows 'someday' has not come for black America,Gut-wrenching raw emotion. That's what I feel right now about the death of George Floyd. Hurt. Pain. That here-we-go-again ball of nerves deep in my stomach ...
29/5/2020,al.com,Jefferson County DAs: George Floyd killing ‘reprehensible' call for ‘consequences’,“The murder of George Floyd an unarmed handcuffed African American male has again highlighted the issue of police brutality in America” they said in the ...
29/5/2020,,,
29/5/2020,CBS Sacramento,Gov. Newsom On George Floyd Death: ‘We’ve Got To Fundamentally Change Who We Are’,SACRAMENTO (CBS13) — California Gov. Gavin Newsom took the first part of his address on Friday to talk about death of George Floyd. The governor talked ...
29/5/2020,Asheville Citizen-Times,How APD is taking steps as we mourn another black man killed by police |OPINION,George Floyd was a human being. He was someone's son someone's family. His death should not be without meaning. Whatever the outcome of the investigation ...
29/5/2020,Grand Forks Herald,COMMENTARY: Patrick Bernadeau: The focus should remain on George Floyd,In the aftermath of four Minneapolis police officers killing George Floyd one of my worst fears has been realized: too many of us have become distracted by the ...
29/5/2020,Politico,Barr announces federal civil rights probe into George Floyd's death,Attorney General William Barr on Friday announced a federal civil rights investigation into the death of George Floyd while in custody of Minneapolis police this ...
29/5/2020,TMZ,New George Floyd Video Shows All 3 Officers on Top of Him,George Floyd had the weight of 3 full-grown men on him -- not just Derek Chauvin on his neck -- when he was killed ... as a new angle of the deadly incident ...
29/5/2020,The Tennessean,'I Will Breathe' Nashville rally in response to George Floyd's death set for this weekend,In the wake of George Floyd's death this week Nashville civil rights activists and others are holding a downtown rally Saturday afternoon at Legislative Plaza.
29/5/2020,NBA.com,Stephen Jackson Karl-Anthony Towns attend rally in support of George Floyd,... a conviction” for the four Minneapolis police officers who were fired after George Floyd's death. Jackson like Floyd is from Houston and said they were friends.
29/5/2020,TwinCities.com-Pioneer Press,Twin Cities suburbs report damage amid protests for George Floyd,As protests over George Floyd's death continued Thursday night various suburbs have reported damage. Most of the unrest was contained to the Twin Cities ...
29/5/2020,,,
29/5/2020,Loveland Reporter-Herald,Voices from the George Floyd protest in Denver,Demonstrators marched from the Colorado State Capitol building demanding justice for George Floyd a man who died at the hands of Minneapolis police ...
29/5/2020,The Denver Post,Michael Porter Jr.’s tweets on George Floyd spark criticism from several NBA players,Michael Porter Jr. said the viral video of a white Minneapolis police officer pinning George Floyd to the ground drew tears to his eyes. “That is murder” Porter ...
29/5/2020,WWAY NewsChannel 3,Local law enforcement officials NAACP react to death of ...,WILMINGTON NC (WWAY) — Law enforcement officials from across the Cape Fear have been voicing their thoughts and reactions to the death of George Floyd ...
29/5/2020,CBS San Francisco,Oakland George Floyd Protest Turns Angry As Marchers Block Freeway Start Looting,Oakland George Floyd Protest Turns Angry As Marchers Block Freeway Start Looting. May 29 2020 at 11:30 pm. Filed Under:Broadway George Floyd George ...
29/5/2020,WABE 90.1 FM,Atlanta Protest Turns Chaotic As Hundreds Respond To ...,George Floyd.” After hours of peaceful protest in downtown Atlanta chaos broke out with demonstrators smashing police cars setting one on fire spray-painting ...
29/5/2020,WKYC.com,Mark Naymik Reports: Cleveland ready for George Floyd protests,CLEVELAND — The death of 46-year-old African-American George Floyd has Cleveland bracing for demonstrations on Saturday against police brutality.
29/5/2020,NBC Connecticut,Connecticut Rally Held in Support of George Floyd,NBC Universal Inc. Hundreds rallied in Hartford Friday to speak out about the death of 46-year-old George Floyd a handcuffed black man who ...
29/5/2020,Chron.com,What Stephen Jackson said about George Floyd in Minneapolis press conference Friday,Former NBA player Stephen Jackson is in Minneapolis seeking justice for his friend George Floyd whose death in Minneapolis police custody Monday sparked ...
29/5/2020,Santa Barbara Independent,Regarding the Death of George Floyd,... George Floyd bring attention to harmful and hurtful actions by officers whose poor decisions tarnish the profession. I am deeply disturbed by Mr. Floyd's death.
29/5/2020,CBS San Francisco,Protest Over Death of George Floyd Shuts Down Upper Deck Of Bay Bridge In San Francisco,Floyd was unarmed and died handcuffed in custody after an officer pressed his knee on his neck for several minutes. The Bay Bridge shutdown happened around ...
29/5/2020,Sporting News,Brian Flores more athletes react to George Floyd death Minneapolis riots,Many people in the sports world have spoken out about the death of George Floyd in Minneapolis and ensuing protests across the country. LeBron James ...
29/5/2020,Green Bay Press Gazette,'Green Bay sending love': Community group travels to Minneapolis to join mourners after George Floyd death,MINNEAPOLIS - A group of Green Bay residents traveled to Minneapolis to protest police brutality after the slaying of George Floyd a black man whose death in ...
29/5/2020,WBUR,Week In Review: Processing The Killing Of George Floyd,We take your calls and hear from our Week In Review panelists as we process the protests in Minneapolis following the death of George Floyd. We hear from:.
29/5/2020,KNBR,Colin Kaepernick speaks steps up after death of George Floyd,That protest was largely because of a white police officer's knee that was placed on George Floyd's throat. In the aftermath of the death of Floyd who pleaded ...
29/5/2020,The New York Times,George Floyd's Death Shows the State Fails Black People,This time it's Minneapolis. Thousands of people have taken to the streets to protest the killing of George Floyd by a police officer who pressed his knee into Mr.
29/5/2020,FOX 9,Cup Foods owner says he will pay for George Floyd's funeral,"It was in Cup Foods that George Floyd allegedly tried to pass a phony twenty dollar bill. The clerk called 911. ""Um someone comes our store and give us fake bills ..."
29/5/2020,KESQ,Local community reacts to death of George Floyd ensuing ...,A peaceful vigil for George Floyd and Ahmaud Arbery will be held in Indio Monday June 1. More information on the vigil can be found here. News / News ...
29/5/2020,WECT,‘Justice for George Floyd’ demonstration planned for Saturday,WILMINGTON N.C. (WECT) - Supporters plan to gather to show solidarity in the call for justice for George Floyd with a demonstration in downtown Wilmington ...
29/5/2020,Washington Post,George Floyd’s death could have been prevented if we had a police culture of intervention,The video of Floyd's killing underscores with terrible clarity why we need a police culture of peer intervention. Imagine if any of the officers on the scene in ...
29/5/2020,Live 5 News WCSC,SC law enforcement community condemns officers’ actions in death of George Floyd,Cases like George Floyd must not only be condemned by the community but also by law enforcement leadership. While a full investigation will occur there is no ...
29/5/2020,fox6now.com,Protesters gathered in memory of George Floyd march across Milwaukee,Protests began as hundreds gathered at 27th and Center for what was supposed to be a one-hour rally. People in the crowd held pictures of George Floyd and ...
29/5/2020,USA TODAY,What one USA TODAY reporter saw during George Floyd protests — until he was temporarily blinded by pepper spray,What one USA TODAY reporter saw during George Floyd protests — until he was temporarily blinded by pepper spray. Tyler J. Davis. USA TODAY.
29/5/2020,The National Interest Online,The George Floyd Tragedy Is Part of a Bigger National Problem,It is tempting to think that this period of racial animosity too will pass—that something will break the fever. But there is cause to be ...
29/5/2020,TMZ,NAACP Providing George Floyd Protesters Face Masks Coping Mechanisms,The George Floyd killing is sparking massive protests in Minneapolis and the local NAACP is helping protesters ... by distributing face masks and tips for coping ...
29/5/2020,NBC Bay Area,Demonstrators Protesting George Floyd's Death Clash With Police in San Jose,NBC Universal Inc. Demonstrators outraged by the death of George Floyd blocked lanes of Highway 101 and clashed with police on city streets Friday afternoon ...
29/5/2020,INSIDER,Former NBA player Stephen Jackson offered an emotional tribute to his 'twin' George Floyd - Insider,"On Friday former NBA player Stephen Jackson offered a heartfelt tribute to his ""twin"" George Floyd at a gathering in Minneapolis. Floyd died on Monday night ..."
29/5/2020,Mass Device,Boston Scientific execs address George Floyd's death in ...,George Floyd 46 died while a Minneapolis police officer pressed his knee on Floyd's neck and bystanders pleaded for the officer to stop. One witness's video ...
29/5/2020,CBS Chicago,Chicago Protesters Block Streets Downtown In Response To George Floyd’s Death,Chicago Protesters Block Streets Downtown In Response To George Floyd's Death. May 29 2020 at 10:23 pm. Filed Under:Chicago Derek Chauvin George ...
29/5/2020,Shawnee Mission Post,Following George Floyd death in Minnesota Lenexa police ...,Lenexa Police Chief Tom Hongslo issued a statement on the death of George Floyd in Minneapolis earlier this week saying the firing of the officers involved had ...
29/5/2020,New York Post,Dr. Michael Baden to perform independent autopsy on George Floyd,Former New York City chief medical examiner Michael Baden will conduct an independent autopsy on George Floyd following his death after being pinned by a ...
29/5/2020,WKYC.com,Cleveland first responders react to the death of George Floyd and actions of police officers,George Floyd Ms. Breonna Taylor and Mr. Ahmad Arbery.” In the letter Montague also says “the organization was founded ...
29/5/2020,NBCSports.com,Nationals' Sean Doolittle makes statement on death of George ...,RIP George Floyd. Earlier this week Washington Wizards star Bradley Beal was among several athletes that tweeted about Floyd's death. Knee on my man neck!!!
29/5/2020,wlfi.com,Local leaders respond to George Floyd death,(WLFI)—As protests erupt around the country over the death of George Floyd local leaders in Tippecanoe County are making strides to send a message that'll ...
29/5/2020,Politico,McConnell says officers involved in George Floyd's death 'look pretty darn guilty',McConnell says officers involved in George Floyd's death 'look pretty darn guilty'. He also condemned the violent protests that spread in the wake of the killing.
29/5/2020,KHOU.com,Houston rapper community activist Trae tha Truth travels to Minneapolis to honor longtime friend George Floyd,Trae told KHOU 11 he visited the spot where George Floyd died while in Minneapolis Police custody. This video file cannot be played ...
29/5/2020,1011now,Protesters in Lincoln show solidarity with George Floyd,The effects of George Floyd's death are not just being felt in Minnesota protests have even made it here to the Capitol City. Stand In For Nebraska organized ...
29/5/2020,U.S. News & World Report,READ: Barack Obama's Statement on George Floyd's Death,Former President Barack Obama released a statement on the death of George Floyd the African-American man killed by a police officer Monday night in ...
29/5/2020,,,
29/5/2020,Fox11online.com,George Floyd protests planned in Appleton residents react to his death and riots,APPLETON Wis. (WLUK) -- George Floyd died late Monday night after police arrested him on suspicion of using a counterfeit $20 bill. One of the videos shows ...
29/5/2020,Appleton Post Crescent,'We hear you': Appleton police chief addresses George Floyd's death shares APD's use-of-force policy,APPLETON - Following the death of George Floyd at the hands of Minneapolis police Appleton Police Chief Todd Thomas shared the department's use-of-force ...
29/5/2020,Salt Lake Tribune,Demonstrators gather at SLC Unitarian church to protest ...,Both events were in response to the slow death of George Floyd a handcuffed black man killed while being restrained by a Minneapolis police officer on ...
29/5/2020,KTVZ,Bend Police voice reactions to George Floyd's death issues of ...,George Floyd have not gone unnoticed by our department and our community members. We are living in difficult times and this horrific situation widens the gap of ...
29/5/2020,The Boston Globe,Boston Scientific with Minnesota ties sends letter to employees on George Floyd’s death,“George Floyd's death reflects deeply ingrained longstanding divisions in our society” chief executive Mike Mahoney wrote. “And it comes at a time when the ...
29/5/2020,WKYC.com,Cleveland social media reacts to protests over George Floyd's killing,In the days since a Minneapolis man named George Floyd was killed while being arrested by four police officers protests and demonstrations across the country ...
29/5/2020,VICE,Far-Right Extremists Are Hoping to Turn the George Floyd Protests Into a New Civil War,Far-Right Extremists Are Hoping to Turn the George Floyd Protests Into a New Civil War. Armed extremists are showing up to protests and urging a “boogaloo” — ...
29/5/2020,WTVQ,Warren County Sheriff's Office schedules city response to ...,(WTVQ) – In response to recent events involving the death of George Floyd the Sheriff's Office schedules an announcement Saturday morning. The Sheriff's Office ...
29/5/2020,Earthworks,Earthworks Executive Director Jennifer Krill's statement on the ...,The murder of George Floyd by police in Minneapolis is the latest killing in an intolerable history of racist violence in the U.S.. Earthworks is committed to ...
29/5/2020,Los Angeles Times,George Floyd's death not looting should outrage us all,It is deserved anger fed by the death of George Floyd yet another unarmed black man killed as police arrested him. Another. That's the key word. The mature and ...
29/5/2020,KVUE.com,'Justice demands accountability' | Mayor Adler speaks about Mike Ramos and George Floyd,'Justice demands accountability' | Mayor Adler speaks about Mike Ramos and George Floyd. Adler said the City is doing what it can to ensure the protests are ...
29/5/2020,Patch.com,Miami-Area Police Chiefs 'Outraged' Over Death Of George ...,"MIAMI FL — Miami-area police chiefs said they were ""upset and outraged"" by the events leading to the death of George Floyd who can be seen on video ..."
29/5/2020,WBUR,Processing Racism Brutality And The Killing Of George Floyd,Protests over the death of George Floyd a black man who died in police custody Monday broke out in Minneapolis for a third straight night. (John Minchillo/AP).
29/5/2020,KOMO News,Seattle protesters clash with police over death of George Floyd,SEATTLE - Dozens of protesters walked through the streets of downtown Seattle overnight to protest the death of George Floyd a black man who died Monday ...
29/5/2020,NBCSports.com,Jackson calls for justice for 'my twin' George Floyd at rally,"""I'm here because they're not gonna demean the character of George Floyd my twin"" Jackson who played with the Warriors for parts of four seasons from 2007 ..."
29/5/2020,The Herald-News,Protest held over George Floyd's death police injustice,Dozens gathered to protest against the death of George Floyd in police custody and the injustices minorities face in society. The protesters gathered in groups ...
29/5/2020,WKYC.com,Cleveland 'United Pastors in Mission' speak out against killing of George Floyd by Minneapolis police officer,Cleveland 'United Pastors in Mission' speak out against killing of George Floyd by Minneapolis police officer. The group released a statement condemning the ...
29/5/2020,Spectrum News 1,Ava DuVernay Speaks on the death of George Floyd,George Floyd's name has become known nationwide as protestors took to the streets following his death. SoCal in 17 host Alex Cohen speaks with ...
29/5/2020,North Country Public Radio,Cuomo on George Floyd case: 'I stand with the protestors',... roiled by protests in the days since a white police officer was filmed on Monday kneeling on the neck of a black man named George Floyd as he arrested him.
29/5/2020,Houston Public Media,Special Edition: George Floyd And The Issue Of Race In America (May 29 2020),For today's episode in reaction to events surrounding the death of Houston native George Floyd at the hands of Minneapolis police officers host Ernie Manouse ...
29/5/2020,The Guardian,Minneapolis protests escalate over George Floyd killing – in ...,Minneapolis was rocked by a third night of protests on Thursday over the death of George Floyd as thousands of demonstrators took to the streets and fires ...
29/5/2020,The Commercial Appeal,Memphis Police Director Michael Rallings condemns use of force in George Floyd case,"George Floyd"" Rallings said in a statement released on Twitter. ""There is no explanation for what we witnessed in Minneapolis. The level of force and the ..."
29/5/2020,WBTV,Charlotte City Council member Braxton Winston arrested during George Floyd protests,George Floyd died in police custody in Minnesota. The white Minneapolis police officer who knelt on Floyd's neck was arrested and charged with murder Friday ...
29/5/2020,wgbh.org,Callie Crossley On The Killing Of George Floyd,Derek Chauvin the ex-police officer who leaned his knee on George Floyd's neck until the man died was charged with third-degree murder and manslaughter ...
29/5/2020,Denverite,How Denver's use of force policy played into the George Floyd ...,Mayor Michael Hancock addresses the city about protests following the killing of George Floyd. May 29 2020. (Kevin J. Beaty/Denverite). Joe Szuszwalak was at ...
29/5/2020,The Philadelphia Inquirer,Temple student: George Floyd’s death in my hometown brings back memories of my classmate | Opinion,But even before George Floyd's death other protests and incidents of Twin Cities police brutality against black men drew widespread attention. I was in the Twin ...
29/5/2020,WNYC,#AskTheMayor: Justice for George Floyd | The Brian Lehrer Show,#AskTheMayor: Justice for George Floyd. Listen 31 min. Queue. Mayor Bill de Blasio holds a media availability. City Hall. Wednesday May 13 2020. ( Ed Reed) ...
29/5/2020,Radio Duna,Las protestas por la muerte de George Floyd y el pronóstico ...,Nicolás Vergara y Matías del Río analizaron las manifestaciones en la ciudad de Minneapolis tras el fallecimiento de un hombre de 46 años producto del brutal ...
29/5/2020,Constant Haïti,Affaire George Floyd : Donald Trump menace les protestaires ...,Des mouvements pacifiques entamés sont devenus de plus en plus violents pour réclamer justice suite au décès de George Floyd stoppé par la police. Un afro- ...
29/5/2020,WDHN - DothanFirst.com,Newsfeed Now Coronavirus: ‘Facts Not Fear’ morning update – May 29 2020,... as three days of violent protests spread to nearby St. Paul and angry demonstrations flared across the U.S over the death of George Floyd a handcuffed black ...
29/5/2020,FOX 10 News Phoenix,Live: News Now,Only on FOX · Equity and Inclusion · Lori Vallow Chad Daybell case · Death of Dion Johnson · Death of George Floyd · Death of Ryan Whitaker · 2020 Census ...
29/5/2020,The FADER,The perversions and simple pleasures of Lady Gaga’s CHROMATICA,How to help in the George Floyd protests and beyond. music / Pop. The perversions and simple pleasures of Lady Gaga's CHROMATICA. On her sixth album ...
29/5/2020,The FADER,Stonebwoy’s “Le Gba Gbe” video is about reaching your happy place,How to help in the George Floyd protests and beyond. music / Dancehall · Premiere. Stonebwoy's “Le Gba Gbe” video is about reaching your happy ...
29/5/2020,Voz de América,Buenos Días América: 05/29/20 | Voice of America - Spanish,TV en Vivo. Vea en directo: Funeral de George Floyd desde Houston thumbnail. VOA Spanish TV. Vea en directo: Funeral de George Floyd desde Houston.
29/5/2020,France Culture,Emeutes américaines et durcissement du régime à Hong Kong,On y voit Georges Floyd immobilisé a terre l'un des quatre policiers lui écrasant le ... over days after George Floyd died in police custody https://t.co/HBaPTVqxjT.
29/5/2020,Constant Haïti,Donald Trump accuse Twitter de s'immiscer dans les élections ...,... ont éclaté pour la troisième nuit consécutive en protestation après la mort de George Floyd. «Ce tweet viole les règles de Twitter sur l'apologie de la violence.
29/5/2020,Voice of America,"What is the future of ""one country two systems?""",NAACP President Speaks to VOA on Death of George Floyd · Twitter Instagram Facebook YouTube RSS. Search VOA News Search. United States · US Politics ...
29/5/2020,WCCO | CBS Minnesota,Minneapolis’ 3rd Precinct Undergoes Clean-Up,... Violence During Floyd ProtestsPolice believe they've identified a man they say was pivotal in escalating the violence following the death of George Floyd.
29/5/2020,Yahoo Actualités,PHOTOS - Le sac à main LV Pont 9 de Louis Vuitton fait ...,Madonna : son fils David rend hommage à George Floyd en dansant et Twitter ne l'épargne pas · Le prince Harry tout sourire dans son jardin de Los Angeles ...
29/5/2020,Constant Haïti,Coronavirus au Brésil : 1156 décès en 24 heures. Le pays ...,... Donald Trump déconfinement Décret décès Démission edh France George Floyd grâce présidentielle Haiti Haïti Joseph Jouthe Jouthe Joseph Jovenel Moïse ...
29/5/2020,Notícias ao Minuto,Vídeo. Ana Guiomar cozinha no 'Você na TV' e deixa prato ...,Propriedade intelectual · Política de privacidade · Ficha técnica · Contactos · Equipa. Pesquisa. Menu. Dossiers ao minuto · Morte de George Floyd · Coronavírus.
29/5/2020,Franceinfo,"""Il est temps"" : Arte prend le pouls de la société post-Covid",... Brésil · Chine · Convention citoyenne sur le climat · Crise en Ukraine · Espagne · Lutte contre le terrorisme · Mort de George Floyd · Opération Barkhane.
30/5/2020,BBC Mundo,Una nueva oleada de protestas por la muerte de George Floyd estremece EE.UU.,... de todo el país para protestar por la muerte bajo custodia de la policía de Minneapolis de George Floyd un afroestadounidense de 46 años el pasado lunes.
30/5/2020,infobae América,Quién era George Floyd: el “gigante amable” que se quedó sin empleo por el coronavirus y cuyo asesinato desató protestas en todo EEUU,Quién era George Floyd: el “gigante amable” que se quedó sin empleo por el coronavirus y cuyo asesinato desató protestas en todo EEUU. El afroamericano de ...
30/5/2020,Washington Post,Video timeline: How George Floyd's death unfolded in ...,On May 25 Minneapolis resident George Floyd was pinned facedown on the ground in handcuffs by a white police officer who pressed his knee against Floyd's ...
30/5/2020,Minneapolis Star Tribune,Ex-police officer Derek Chauvin charged with murder ...,... murder and manslaughter charges that accuse a fired Minneapolis police officer of killing George Floyd — an act caught on video and seen around the world ...
30/5/2020,Texas Monthly,The Houston Years of George Floyd,... the man in the video—who was facedown on the pavement his neck pressed under the knee of a Minneapolis cop—was her childhood friend George Floyd.
30/5/2020,Minneapolis Star Tribune,A deeper look at the four officers fired after George Floyd death,... fired Minneapolis police officer Derek Chauvin is in custody and accused of murder while the three other ex-officers present at George Floyd's fatal arrest are ...
30/5/2020,The New York Times,George Floyd Protests in N.Y.C.: Unrest in Brooklyn as de Blasio Appeals for Calm,Protesters angry over the death of George Floyd in Minneapolis clashed with the police across Brooklyn and Lower Manhattan on Friday night in a series of ...
30/5/2020,WTOP,DC protests over George Floyd’s death continue for second day pepper spray deployed near White House,DC protests over George Floyd's death continue for second day pepper spray deployed near White House. Matthew Delaney. May 30 2020 2:35 PM.
30/5/2020,CBS Miami,Miami’s George Floyd Protest Turns Violent With Car Fires Tear Gas Looting,MIAMI (CBSMiami) – What started as a peaceful protest in Miami by people demanding justice for George Floyd in Minneapolis turned violent several hours ...
30/5/2020,NBC News,May 29 coverage of nationwide unrest and ongoing protests,Derek Chauvin the former Minneapolis police officer seen kneeling on the neck of George Floyd before his death was arrested Friday on charges of third-degree ...
30/5/2020,NBC News,Curfews go into effect in cities around the country as George Floyd protests continue,Curfews go into effect in cities around the country as George Floyd protests continue. Curfews will be in effect Saturday evening in Minneapolis Seattle Portland ...
