fecha,fuente,titulo,encabezado
31/5/2020,The Philadelphia Inquirer,In Camden police and protesters take a different path after George Floyd’s killing,As Philadelphia shot up in flames Saturday and cops forcefully cracked down on residents protesting police brutality and the killing of George Floyd Camden ...
31/5/2020,NBC News,From Eric Garner to George Floyd: Protests reveal how little has changed in 6 years,From Eric Garner to George Floyd: Protests reveal how little has changed in 6 years. A national reckoning over police brutality in 2014 was not enough to stop the ...
31/5/2020,The Daily Pennsylvanian,After city protests and violence Gutmann addresses George ...,In light of the police killing of George Floyd Penn President Amy Gutmann released an emailed statement to the Penn community regarding his death.
31/5/2020,LAist,LA Protests Over Death Of George Floyd Stretch Into 5th Day,Scenes from Los Angeles Sunday May 31 2020 during the fifth day of protests over the death of George Floyd in Minneapolis. (Chava Sanchez/LAist).
31/5/2020,ESPN,Hamilton calls out 'white dominated' F1 for silence over George Floyd,... the death of George Floyd. Floyd who is black died in police custody in Minnesota after a white police officer kneeled on his neck for more than eight minutes.
31/5/2020,Wisconsin Public Radio News,George Floyd Protests Continue Sunday Around Wisconsin,Marches and gatherings over the killing of George Floyd a Minneapolis man who died in police custody last week continued Sunday across Wisconsin ...
31/5/2020,Greeley Tribune,Clashes begin earlier in third day of Denver protests for George Floyd,Protesters are outraged over the death of George Floyd a 46-year-old black man who was killed by a Minnesota police officer who pinned him to the ground with ...
31/5/2020,CBS Sacramento,Looting Vandalism And Freeway Takeover In Third Day Of Sacramento George Floyd Protests,... of George Floyd who died while in police custody in Minneapolis on Monday. ... Chavez Park at 2 p.m. to engage in a George Floyd solidarity action event.
31/5/2020,Baltimore magazine,Baltimore Responds to the Death of George Floyd,In the days since the death of George Floyd a 46-year-old African-American man who died after being pinned to the ground by a white police officer in ...
31/5/2020,CNN,A sheriff put down his baton to listen to protesters. They chanted 'walk with us' so he did,He was speaking to the crowd protesting police brutality and the death of George Floyd in Minneapolis. Read More. He smiled and high-fived people in the ...
31/5/2020,nj.com,‘No justice no peace.’ Protests continue across N.J. after George Floyd’s death.,' Protests continue across N.J. after George Floyd's death. Updated May 31 2020; Posted May 31 2020.
31/5/2020,CBS Baltimore,George Floyd Death: DC Mayor Issues Citywide Curfew Sunday Night; 18 Arrested For Rioting Over Weekend,George Floyd Death: DC Mayor Issues Citywide Curfew Sunday Night; 18 Arrested For Rioting Over Weekend. May 31 2020 at 11:15 pm. Filed Under:Curfew DC ...
31/5/2020,Globalnews.ca,George Floyd protest in Montreal declared illegal after violence breaks out,George Floyd died in Minneapolis on Monday after pleading for air while a white police officer pressed a knee on his neck. His death has sparked nightly protests ...
31/5/2020,Chicago Tribune,George Floyd fallout: Here’s what happened May 31 in the Chicago area,The day started with workers boarding windows that had been smashed the night before after what started out as a protest of the death of George Floyd in ...
31/5/2020,syracuse.com,How George Floyd protests in Syracuse went from peaceful to chaotic,Syracuse N.Y. — The thwack of a bat into an Onondaga County courthouse window signaled Syracuse's nonviolent protest was about to turn into a riot.
31/5/2020,West Virginia MetroNews,Peaceful protests over death of George Floyd social injustice ...,Hundreds took to the streets in Charleston to protest the death of George Floyd. Jake Flatley/wvmetronews.com. A group of African-American women spoke on the ...
31/5/2020,cleveland.com,See 97 incredible photos of Cleveland’s rally for George Floyd as it turned from peaceful to riotous,Men chucking bricks at the glass of the Justice Center. As Saturday's rally for justice in the wake of the Minneapolis police killing of George Floyd devolved from ...
31/5/2020,NPR,Joyce Beatty: Destruction Is 'A Distraction To The Message',"... accompanying protests over the death of George Floyd is a ""distraction to the ... get hurt that's not going to resolve the problem of why George Floyd died.""."
31/5/2020,ESPN,George Floyd's death opens old wound for 'horrified' Thabo Sefolosha,"Such was the scenario when George Floyd died in Minneapolis last week and when Sefolosha watched that video his memories came flooding back. ""I was just ..."
31/5/2020,The Guardian,George Floyd’s brother says Trump ‘kept pushing me off’ during phone call,George Floyd's brother says Trump 'kept pushing me off' during phone call. This article is more than 1 month old. Philonise Floyd says president dismissed him ...
31/5/2020,CNBC,Read the email Tim Cook sent to Apple employees about George Floyd,... sent a memo to employees Sunday addressing the killing of George Floyd. Protests have erupted nationwide after the killing of Floyd an unarmed black man ...
31/5/2020,The Advocate,George Floyd protest in Baton Rouge: See photos videos of ...,protest crowd. Protesters gather in downtown Baton Rouge in protest to the killing of George Floyd in ...
31/5/2020,nj.com,Newark’s peaceful protests of George Floyd’s death draw on lessons from city’s history,When plans were announced for a protest Saturday in Newark over the death of George Floyd at the hands of a white Minneapolis police officer Ambrose said ...
31/5/2020,CBS Pittsburgh,‘This Is Unacceptable’: Gov. Wolf Condemns Violence At George Floyd Protests Pa. National Guard Preemptively Sent To Allegheny County,Wolf Condemns Violence At George Floyd Protests Pa. National Guard Preemptively Sent To Allegheny County. May 31 2020 at 2:18 pm. Filed Under:George ...
31/5/2020,San Francisco Chronicle,Looting follows George Floyd protests in SF Oakland with fire set in Westfield mall,Looters broke into and damaged stores in several Bay Area cities on Saturday during the second night of chaos in the wake of the police killing of George Floyd.
31/5/2020,KRQE News 13,Thousands attend Sunday vigil for George Floyd march down Central,... far peaceful protest in downtown Albuquerque took place on Sunday in response to the death of George Floyd. The protest started near Central and University ...
31/5/2020,CBS New York,Cuomo Addresses George Floyd Protests Saying Violence ‘Dishonors Mr. Floyd’s Death’,Andrew Cuomo focused on the protests brought on by George Floyd's death in police custody at his daily briefing Sunday. “Last night was a long and ugly night all ...
31/5/2020,AppleInsider,Apple Stores smashed and looted amid George Floyd protests,The death of an unarmed man George Floyd during an arrest in Minneapolis Minnesota has prompted protests in at least 30 cities across the United States.
31/5/2020,Fox News,Susan Rice makes claim Russians could be behind violent George Floyd demonstrations,George Floyd death sparks nationwide protests. Fox News correspondent Alicia Acuna reports. Former Obama administration national security adviser Susan Rice ...
31/5/2020,WANE,WATCH: The heart and chaos of Fort Wayne’s protest for George Floyd,Protesters are demanding justice for George Floyd the man who died in Minneapolis after a police officer pressed his knee on Floyd's neck for more than eight ...
31/5/2020,VoiceofOC,Police Declare Huntington Beach George Floyd Protest ...,... an unlawful assembly less than an hour after protesters gathered to voice their objection to the police killing of George Floyd a black man in Minneapolis last ...
31/5/2020,CBS Philly,Atlantic City Police: 8 P.M. Curfew Implemented After Peaceful George Floyd Protest ‘Transitioned To Criminal Activity’,Curfew Implemented After Peaceful George Floyd Protest 'Transitioned To Criminal Activity'. By CBS3 Staff May 31 2020 at 10:00 pm. Filed Under:Atlantic City ...
31/5/2020,Morristown Green,Activists rally in Morristown Morris Township to demand ...,Chanting “No Justice No Peace!” activists on Saturday staged a peaceful procession from Morristown to Morris Township for a vigil in memory of George Floyd ...
31/5/2020,Rochester Democrat and Chronicle,Cuomo pleads to end violence after George Floyd death; more police head to upstate cities,... and additional officers to other upstate cities Sunday to quell violence sparked by police-brutality protests following the death of George Floyd in Minneapolis.
31/5/2020,KTVB.com,Hundreds peacefully protest George Floyd's death and racial turmoil in downtown Boise: 'Racism needs to stop. Period.',... Idaho State Capitol Building in downtown Boise on Sunday morning as part of peaceful protest in response to George Floyd's death in Minneapolis last week.
31/5/2020,Centre Daily Times,Hundreds attend peaceful protest in State College to demand justice for George Floyd,But hundreds of people carrying signs and wearing masks flooded into the area Sunday afternoon during a peaceful protest to demand justice for George Floyd ...
31/5/2020,Spectrum News 1,Protesters Gather in Dayton to Protest Death of George Floyd,DAYTON Ohio — Dozens of people gathered Saturday afternoon at the federal building in Dayton to protest the death of George Floyd.
31/5/2020,San José Spotlight,San Jose imposes a curfew hundreds protest George Floyd ...,Protesters faced off with a line of San Jose police officers in the third day of protests over the death of George Floyd an unarmed black man in Minneapolis. Photo ...
31/5/2020,NBC 15 WPMI,Mayor Stimpson releases statement on death of George Floyd,MOBILE Ala. (WPMI) — Mobile Mayor Sandy Stimpson released a statement on social media today about the death of George Floyd who died in the custody of ...
31/5/2020,WBHM,Birmingham's Civil Rights History Front And Center At Rally ...,... swelled with people signs and chants Sunday afternoon for what organizers called a rally for justice and peace in response to the death of George Floyd who ...
31/5/2020,Parsippany Focus,Prosecutor's Office Issues Statement on the death of George ...,Knapp issues the following statement on the death of George Floyd in Minneapolis: “During my tenure as Morris County Prosecutor I have always made ...
31/5/2020,Sporting News,Falcons' Kaleb McGary apologizes for 'misguided' tweet about George Floyd protests,Protesters have gathered around the country voicing their frustrations following George Floyd's death in Minnesota. Some protests have turned into riots in ...
31/5/2020,Jewish Telegraphic Agency,'Believe us': Black Jews respond to the George Floyd protests in their own words,... his city — Minneapolis — was being torn apart during a fifth night of unrest following the death of George Floyd a black man in police custody there last week.
31/5/2020,lehighvalleylive.com,Hundreds rally in Allentown over George Floyd killing (PHOTOS),Hundreds took to the streets of Allentown on Saturday in protest over police brutality and demanded justice for George Floyd. Floyd a 46-year-old Black man ...
31/5/2020,Coral Springs Talk,Coral Springs Students Plan Peaceful Protest for George Floyd - Coral Springs Talk,By Saraana Jamraj. After the murder of George Floyd by a Minnesota police officer a pair of two young cousins in Coral Springs was motivated to plan a ...
31/5/2020,13newsnow.com WVEC,Newport News pastors leaders hold community rally following George Floyd death protests in US,The rally is in response to the recent protests taking place nationally after the death of George Floyd in Minnesota. Video showed former Minneapolis police officer ...
31/5/2020,Baristanet,Glen Ridge Mourns George Floyd Stands In Support of Black ...,Glen Ridge Mourns George Floyd Stands In Support of Black Lives Matter at Vigil Against Racism. Liz George - May 31 2020. Hundreds ...
31/5/2020,Fox Business,Nordstrom Nike decry George Floyd killing as rioters loot stores,Iconic brands Nike and Nordstrom have decried racism after the killing of George Floyd in Minneapolis as their stores throughout U.S. cities were looted during ...
31/5/2020,Auburn Citizen,Auburn peacefully protests police brutality in wake of George Floyd's death,The marches and protests follow the death of 46-year-old George Floyd a black man who was killed Monday by a Minneapolis police officer. A video of the ...
31/5/2020,NBC News,Authorities identify federal officer killed in Oakland during George Floyd protest,Authorities identify federal officer killed in Oakland during George Floyd protest. The FBI's San Francisco field office said the officer Dave Patrick Underwood died ...
31/5/2020,The Daily Gazette,Following Albany unrest curfew declared in Schenectady ...,Unrest and protests locally and nationally were sparked by the death of George Floyd in Minnesota at the hands of a Minneapolis police officer. Schenectady's ...
31/5/2020,BBC Brasil,George Floyd: o que aconteceu antes da prisão e como foram seus últimos 30 minutos de vida,E culminou na morte de George Floyd um homem afro-americano de 46 anos que haviaa acabado de ser preso pela polícia em Minneapolis Minnesota nos ...
31/5/2020,Aljazeera.com,Remembering George Floyd: Devoted father 'gentle giant',Remembering George Floyd: Devoted father 'gentle giant'. Friends and relatives pay tribute to the Black man who suffocated under the knee of a white policeman ...
31/5/2020,CBS Sacramento,Multiple People Arrested During Modesto George Floyd Protests,... (CBS13) – Multiple people were arrested as crowds protesting the death of George Floyd move through downtown Modesto on Sunday authorities said.
31/5/2020,WSLS 10,Lawmakers react to ongoing protests violence after death of George Floyd,“George Floyd should still be alive and if he had been white he almost certainly would be. We know that the criminal justice system treats people differently based ...
31/5/2020,Fullerton Observer,George Floyd Demonstration in Fullerton,The killing sparked months of weekly protests at the Fullerton Police Station. IMG_3780. Demonstrators gather to protest the police killing of George Floyd. About ...
31/5/2020,Fox News,Big-city Dems who had imposed strict coronavirus lockdowns now let George Floyd rioters flout rules,... on strict quarantine measures -- line up to champion the nationwide mass demonstrations over the in-custody death of George Floyd sans social distancing.
31/5/2020,loudounnow.com,Peaceful George Floyd Demonstration Planned in Leesburg Today,The walk is in response to the death of George Floyd an African American man who was killed while in police custody last week. Floyd's death has set off ...
31/5/2020,The Mercury News,Ex-prosecutor: Complaint against Minnesota cop Derek Chauvin in George Floyd case drops important clues,... complaint charging former Minneapolis police officer Derek Chauvin with third-degree murder and second-degree manslaughter for the death of George Floyd ...
31/5/2020,WMDT,Protesters gather in Cambridge on Sunday over death of ...,– People of all races gathered to peacefully protest the death of George Floyd an unarmed black man who died in police custody in Minneapolis last Monday. “We' ...
31/5/2020,CBS Baltimore,George Floyd Death: Protesters Take Knee In Towson March In Hagerstown,TOWSON Md. (WJZ) — After two consecutive days of demonstrations in Baltimore in the wake of the in-custody death of George Floyd in Minneapolis other ...
31/5/2020,Greenville News,'Our Emmett Till moment': Megachurch pastors Gray Furtick respond to the killing of George Floyd,“George Floyd dying on TV with a knee on his neck was our Emmett Till moment where we see the brutality and the lack of humanity that we can literally not ...
31/5/2020,The Brown and White,Simon Schiffer speak out on George Floyd,Nearly one week after the murder of George Floyd — and after several nights of unrest across America — President John Simon sent an email to the Lehigh ...
31/5/2020,Fox Business,George Floyd killing has Starbucks JPMorgan AT&T addressing racial injustice,George Floyd killing has Starbucks JPMorgan AT&T addressing racial injustice. Starbucks CEO Kevin Johnson reaches out to employees after George Floyd's ...
31/5/2020,CBS Sacramento,Bloody Teen Hit By Rubber Bullet Carried From Saturday’s George Floyd Protests In Sacramento,... teenager was rushed to the hospital with a bloody face after being struck with a rubber bullet during the second night of George Floyd protests in Sacramento ...
31/5/2020,WCCO | CBS Minnesota,Peaceful Protest Groups In Mpls. And St. Paul Arrested; 2nd Peaceful Mpls. Group Gathers At Site Of George Floyd’s Death Post-Curfew,Group Gathers At Site Of George Floyd's Death Post-Curfew. May 31 2020 at 11:45 pm. Filed Under:George Floyd John Harrington Local TV ...
31/5/2020,The New York Times,Destructive Power of Despair,As protests and rioting have swept across the country in the wake of the killing of George Floyd by the police in Minneapolis it's evident that America has failed ...
31/5/2020,WKMG News 6 & ClickOrlando,Businesses vandalized near Mall at Millenia as demonstrators protest George Floyd’s death,Several businesses near Mall at Millenia were smashed late Saturday night as protestors took to the area to protest George Floyd's death. The Container Store ...
31/5/2020,The Guardian,Fire pestilence and a country at war with itself: the Trump presidency is over,How has Trump responded to the widespread unrest following the murder in Minneapolis of George Floyd a black man who died after a white police officer knelt ...
31/5/2020,The New York Times,How George Floyd Was Killed in Police Custody,The Times has reconstructed the death of George Floyd on May 25. Security footage witness videos and official documents show how a series of actions by ...
31/5/2020,CNN,The Death of George Floyd: A Timeline,"From the moment he said ""I can't breathe"" to protests and violence in cities across the US George Floyd's death at the hands of Minneapolis police officers has ..."
31/5/2020,,,
31/5/2020,NPR,George Floyd Protests Show Rage And Anguish : The Picture ...,George Floyd Protests Show Rage And Anguish : The Picture Show Photos show demonstrators and police clashing as anguish and rage swept through cities ...
31/5/2020,KSTP,GoFundMe for George Floyd's family raises more than $6.5M in 4 days,A GoFundMe page dedicated to George Floyd has raised more than $6.5 million in four days. George Floyd's brother Philonise Floyd organized the page ...
31/5/2020,KHOU.com,Houston pastor says George Floyd was a gatekeeper allowing for his ministry in Third Ward,"Houston pastor says George Floyd was a gatekeeper allowing for his ministry in Third Ward. ""I owe much of what I was able to do because of 'Big Floyd'"" ..."
31/5/2020,Montclaire News,A Statement from President Cole Concerning the Death of ...,The death of George Floyd is yet another tragic reminder of the bias and violence that exist in our society. This incident and too many like it is deeply troubling ...
31/5/2020,The Guardian,'Mr President don't go hide': China goads US over George Floyd protests,'Mr President don't go hide': China goads US over George Floyd protests. Officials and state media appear to revel in scenes of US unrest comparing protests ...
31/5/2020,The Atlantic,How Do You Kneel on a Neck for Nine Minutes?,... and the video of Derek Chauvin then a Minneapolis police officer and now a civilian charged with murder kneeling into the neck of George Floyd is about as ...
31/5/2020,WTOP,Black Marylanders fearful after George Floyd death; Mfume calls it ‘murder’,African Americans fear the police in Maryland. Many see parallels to the recent death of Minnesota resident George Floyd and what could happen to them. On the ...
31/5/2020,The New York Times,George Floyd Hong Kong SpaceX: Your Weekend Briefing,Outrage over the death of George Floyd has incited a wave of demonstrations and unrest across the country. From the streets of Minneapolis where Mr. Floyd went ...
31/5/2020,The News Journal,Wilmington assesses damage inflicted by George Floyd protests Saturday night,Demanding justice for George Floyd and pleading for changes to address racial inequities in their community Wilmington residents marched miles through the ...
31/5/2020,USA TODAY,'Perfect storm' of civil unrest following George Floyd's death unique effective experts say,this weekend in the wake of the death of George Floyd an African American man who pleaded that he could not breathe after a white police officer kneeled on his ...
31/5/2020,NBC 15 WPMI,Protesters march in Mobile over death of George Floyd,MOBILE Ala. (WPMI) —. Facebook. Posted by WPMI NBC 15 News. Loading... Try Again. Cancel. Loading... Loading... Protesters gathered along Airport Blvd.
31/5/2020,USA TODAY,'Riots' 'violence' 'looting': Words matter when talking about race and unrest experts say,Riots erupted in cities across the country this weekend after the death of George Floyd and the destruction was widely condemned by the president local ...
31/5/2020,USA TODAY,Justice for George Floyd: Changing laws is 'woefully insufficient',The police in Minneapolis had confronted George Floyd on suspicion of a nonviolent crime. Onlookers who joined him in pleading with the arresting officer to ...
31/5/2020,KPRC Click2Houston,Trae tha Truth Bun B Mayor Turner and George Floyd’s family plan to march from Discovery Green Tuesday,“Make no mistake George Floyd was a Houstonian born and raised in the Third Ward and so this could have happened to any person of color in the city of ...
31/5/2020,USA TODAY,The birth of the #WalkWithUs movement: Local leaders join George Floyd protesters across US in a show of solidarity,As local leaders joined protesters across the nation to show solidarity in the wake of the death of George Floyd an unarmed black man who died in the custody ...
31/5/2020,VVdailypress.com,Victorville rally draws dozens protesting George Floyd’s death and others,Protestors gather to rail against the death of George Floyd a man who died in police custody and others on the Bear Valley overpass in Victorville on Sunday ...
31/5/2020,Duke Chronicle,'We're stronger together': Durham protest decries George ...,A crowd protests George Floyd's death and police brutality outside the Durham Police Department headquarters Saturday. Photo by Em Adler | The Chronicle. By ...
31/5/2020,CBS Baltimore,George Floyd Death: Gov. Hogan Says Baltimore ‘Showed The Nation How To Promote Positive Change’ With Demonstrations This Weekend,George Floyd Death: Gov. Hogan Says Baltimore 'Showed The Nation How To Promote Positive Change' With Demonstrations This Weekend. By Annie Rose ...
31/5/2020,Boulder Police Department,Boulder Police Chief Maris Herold Speaks Out on Death of ...,I stand with police leaders and officers across the country in condemning the death of George Floyd. This is a time for action. We need police reform on a national ...
31/5/2020,Maui Now,Maui Peaceful Paddle Out for George Floyd,A peaceful Paddle Out for George Floyd was held just before sunset on the West shores of Maui on Sunday in a show of unity amid tensions nationally over the ...
31/5/2020,,,
31/5/2020,,,
31/5/2020,SW News Media,Protesters march through downtown Chaska following George ...,Chaskans joined dozens of other cities in protesting the death of George Floyd a Black man who died in Minneapolis police custody last week. “No justice no ...
31/5/2020,WATE 6 On Your Side,Protests emerge across Tennessee after the death of George Floyd in Minnesota,Floyd was an unarmed black man in Minneapolis Minnesota who died in police custody after Officer Derek Chauvin pressed his knee on Floyd's neck even as ...
31/5/2020,Forbes,Hollywood Responds To The Senseless Death Of George Floyd Riots,"""The recent killing of George Floyd is the latest in a series of deplorable events that highlight the need for real change in how we address our diversity as a society ..."
31/5/2020,,,
31/5/2020,,,
31/5/2020,INFORUM,Letter: George Floyd was a positive force in our grandson's life,Like most North Dakotans we were shocked at the death of George Floyd in Minneapolis last Monday. That it had happened so close to our Red River Valley ...
31/5/2020,The Daily Gazette,Video from Sunday's George Floyd protest in Schenectady,Videos from Sunday's George Floyd protest in Schenectady. Sunday's protest included the protesters twice going to the Schenectady Police Department.
31/5/2020,Poynter,In nearly every state front pages capture outrage after George ...,It's not just the death of George Floyd. People in communities around the country gathered to protest continuing violence against black Americans. “Time to speak ...
31/5/2020,KARE11.com,'Very few incidents' reported Sunday night police warn there are still 'outside agitators' in Twin Cities,Sunday began with hours of peaceful protest from thousands of demonstrators calling for justice for George Floyd. Just before 6 p.m. a near-tragedy occurred ...
31/5/2020,syracuse.com,People gather outside Wegmans in DeWitt to protest killing of George Floyd police brutality,People gather outside Wegmans in DeWitt to protest killing of George Floyd police brutality. Updated May 31 2020; Posted May 31 2020.
31/5/2020,The Daily Gazette,George Floyd protests in Schenectady remain peaceful; Police ...,Schenectady Police Chief Eric Clifford kneels down Sunday in solidarity with protesters angered by the death of George Floyd. Photographer: marc schultz/staff ...
