fecha,fuente,titulo,encabezado
29/5/2020,WFAA.com,'I can't breathe': Protests in honor of George Floyd Breonna Taylor take place in downtown Dallas and Fort Worth,The deaths of George Floyd and Breonna Taylor have sparked protests and calls for justice across the U.S.. This video file cannot be played ...
29/5/2020,WCNC.com,Charlotte protesters clash with police,Protesters had gathered outside Charlotte Mecklenburg Police Department on Beatties Ford Road to protest the death of George Floyd in Minneapolis.
29/5/2020,USA TODAY,'A riot is the language of the unheard': MLK's powerful quote resonates amid George Floyd protests,But amid nationwide protests spurred by the killings of George Floyd and Breonna Taylor a 1967 speech by King at Stanford University has become ...
29/5/2020,Minnesota Public Radio News,Uncle of George Floyd calls for peace,George Floyd died Monday after a white police officer knelt on his neck. Floyd's death has set off days of violent protests in the Twin Cities and across the U.S..
29/5/2020,NBCSports.com,Why Chris Long was moved by Wentz's tweet about George ...,... Thursday night when his former teammate Carson Wentz posted a tweet calling out “institutional racism” in the wake of George Floyd's death in Minneapolis.
29/5/2020,Washington Post,‘Let my building burn’: Minneapolis restaurateur prioritizes justice for George Floyd while others bemoan the damage,'Let my building burn': Minneapolis restaurateur prioritizes justice for George Floyd while others bemoan the damage. By Tim Carman.
29/5/2020,Wisconsin Public Radio News,Demonstrators Gather In Milwaukee To Protest George Floyd ...,Demonstrators marched in two separate protests in Milwaukee on Friday: One demanding justice for George Floyd a Minneapolis man who was killed by police ...
29/5/2020,FOX13 Memphis,#ICANTBREATH protest for George Floyd ended peacefully in Downtown Memphis,Peaceful protest in Downtown Memphis for injustice killing of George Floyd. Share; Share; Share. Updated: ...
29/5/2020,Washington Post,School district fires wrestling coach over media post defending police in George Floyd’s death,George Floyd a 46-year-old father of two died Monday after being handcuffed by Minneapolis police and pinned to the ground with an officer's knee on his neck ...
29/5/2020,KRQE News 13,New Mexico police chief shares stance on George Floyd’s death,NEW MEXICO (KRQE) – George Floyd's death has had an impact in New Mexico. There's been a protest and a police chief is speaking out. Farmington Police ...
29/5/2020,AS Usa,Muerte de George Floyd: fotografías de las protestas en Minneapolis,La muerte de George Floyd ha provocado varias manifestaciones en la ciudad de Minneapolis desde el martes mismas que se han tornado un poco violentas.
29/5/2020,CNN,Nuevo video muestra que tres policías presionaron sus rodillas sobre George Floyd,Un nuevo video sobre el caso de George Floyd hombre negro que murió luego de que policías de Minneapolis lo sometieron mientras él seguía repitiendo que ...
29/5/2020,KVAL,March in Eugene to protest George Floyd death takes destructive turn,A few hundred people gather at the intersection of 7th & Washington in downtown Eugene Oregon to protest the killing of George Floyd by a police officer in ...
29/5/2020,Cincinnati.com,Protesters break windows at justice center OTR businesses during rally over George Floyd's death,Protesters flooded the streets of downtown Cincinnati and Over-the-Rhine on Friday night sparked by the death of George Floyd. Here is how the night went:.
29/5/2020,ESPN,Miami Dolphins coach Brian Flores releases statement on George Floyd Minneapolis events,Following the deaths of George Floyd Breonna Taylor and Ahmaud Arbery who are all African American Flores released a statement to ESPN on Friday ...
29/5/2020,KY3,Springfield protest planned for Saturday after death of George ...,throughout downtown Springfield. The protest comes in response to the death of George Floyd. A bystander's video showed Minneapolis Officer Derek Chauvin ...
29/5/2020,WKYC.com,Cleveland Cavaliers release statement on tragic death of George Floyd,“The death of George Floyd is heartbreaking appalling and tragic. Our collective humanity suffers greatly in the midst of senseless acts like this. Not just now but ...
29/5/2020,Anadolu Agency,AU chief condemns 'murder' of George Floyd,AU chief condemns 'murder' of George Floyd. African Union rejects 'continuing discriminatory practices' against black citizens of US. Addis Getachew | 29.05.2020.
29/5/2020,LancasterOnline,Anti-racism protests planned this weekend in Lancaster ...,A new protest against racism following the killing of George Floyd is scheduled for Saturday. KIRK NEIDERMEYER | LNP.
29/5/2020,Monterey County Weekly,'Justice for George Floyd' protest in Monterey organized for Saturday morning.,On Saturday morning May 29 between 9-10am there will be a “Call for Justice“ demonstration over the death of George Floyd at the Window on the Bay in ...
29/5/2020,,,
29/5/2020,VICE,Minneapolis Bus Drivers Refuse to Transport George Floyd Protesters to Jail,Minneapolis Bus Drivers Refuse to Transport George Floyd Protesters to Jail. Organized labor throughout the city is banding together in solidarity against police ...
29/5/2020,CBS Sacramento,Hundreds Of Black Lives Matter Activists Protest Death Of George Floyd In Sacramento,SACRAMENTO (CBS13) – Hundreds of Black Lives Matter activists gathered in South Sacramento to protest the death of George Floyd who died in Minneapolis ...
29/5/2020,The New York Times,George Floyd Police Accountability and the Supreme Court,The courts protected police abuses for years before George Floyd's death. It's time to rethink “qualified immunity.” By The Editorial Board. The editorial board is a ...
29/5/2020,WFMYNews2.com,Triad sheriffs police chiefs respond to the death of George Floyd,On behalf of the Winston-Salem Police Department and the Forsyth County Sheriff's Office I extend our sincerest of condolences to the family of Mr. George Floyd ...
29/5/2020,WCJB,Friends of George Floyd remember the former South Florida ...,“I saw it and immediately recognized it and said that's George. That's big Floyd” said Marvin Lawton owner at Magazine Ready Barbershop in Avon Park. Lawton ...
29/5/2020,News8000.com - WKBT,Pictures from vigil protest in La Crosse in honor of George Floyd,Pictures from vigil protest in La Crosse in honor of George Floyd. May 29 2020 10:58 PM. Mike Thompson. Posted: May 29 2020 10:58 PM. Updated: May 29 ...
29/5/2020,TwinCities.com-Pioneer Press,Former Minneapolis officer Derek Chauvin charged with murder in death of George Floyd arrested by BCA,The Minneapolis police officer involved in the death of George Floyd was charged Friday by the Hennepin County attorney with third-degree murder and ...
29/5/2020,Volume One,Virtual Vigil for George Floyd Planned in Eau Claire,Germaine is featured on the Facebook event for the George Floyd Remembrance Vigil and Community Discussion. On Sunday afternoon Selika Ducksworth- ...
29/5/2020,Toledo Blade,Mayor community leaders discuss George Floyd protests,The meeting came four days after the death of George Floyd an African-American man who was shown on video lying on the ground while a Minneapolis police ...
29/5/2020,The B-Town Blog,King County Sheriff Mitzi G. Johanknecht releases statement on George Floyd killing - The B-Town (Burien) Blog,The video of a Minneapolis Police officer kneeling on the neck of George Floyd and his subsequent death is heartbreaking and disturbing. I see an officer willfully ...
29/5/2020,NBCSports.com,Ayesha rips Trump over tweet calling protesters 'THUGS',These THUGS are dishonoring the memory of George Floyd and I won't let that happen. Just spoke to Governor Tim Walz and told him that the Military is with ...
29/5/2020,Knoxville News Sentinel,Hundreds demonstrate in Knoxville over Floyd's death; Mayor Kincannon condemns brutality,'Say his name':How Knoxville protested the killing of George Floyd. The planned protest came amid growing unrest across the country after a white police officer ...
29/5/2020,KSTP,Community leaders call for justice for George Floyd say arrest of 1 former officer 'not enough',Photo: KSTP/Kirsten Swanson. People gather at Government Center Plaza in Minneapolis for a rally calling for justice for George Floyd Friday afternoon. KSTP
29/5/2020,KEYT,Central Coast leaders respond to George Floyd's death,Floyd died on Monday while Minneapolis Minnesota police officers were handcuffing and pinning him to the ground. The Santa Barbara Police Chief Lori Luhnow ...
29/5/2020,,,
29/5/2020,KSAT San Antonio,BCSO cadets get refresher training amid George Floyd’s death,SAN ANTONIO – George Floyd's death has not only sparked protests and outrage across the country but also responses for how peace officers can do better.
29/5/2020,Long Beach Press Telegram,Long Beach police chief condemns actions of officers tied to George Floyd death,... officers involved in the apprehension of George Floyd whose in-custody death has sparked national protests about police use-of-force and people of color.
29/5/2020,Josh Kurtz,Black Marylanders Fearful After George Floyd Death; Mfume Calls It 'Murder',African Americans fear the police in Maryland. Many see parallels to the recent death of Minnesota resident George Floyd and what could happen to them.
29/5/2020,The Detroit News,Whitmer on death of George Floyd: 'Black lives under threat every day',"Gov. Gretchen Whitmer said Friday the family of George Floyd deserves a ""thorough and timely impartial"" investigation into the circumstances surrounding his ..."
29/5/2020,Madison.com,Protesters plan Capitol demonstration to 'demand justice' following George Floyd's death,As protests spread across the nation in response to George Floyd's death in Minneapolis police custody demonstrators are poised to gather at the Wisconsin ...
29/5/2020,nj.com,N.J. restaurant apologizes for ‘I can breathe’ sign pulled into George Floyd controversy,What was done to George Floyd on Monday is a disgrace and there is NO way we support that. The post that is circulating right now is from over 6 years and if I ...
29/5/2020,KEYT,Oxnard Police Chief speaks on George Floyd's death,Oxnard Police Department Chief Scott Whitney shared a solemn message on Facebook regarding George Floyd's death mistrust of the police and more.
29/5/2020,Labor Notes,Twin Cities Labor Mobilizes Against George Floyd Murder,The organized labor movement has begun swinging into action to support protests against the racist police murder of Minneapolis resident George Floyd.
29/5/2020,WAMU 88.5,Demonstrators In DC Gather To Protest Death Of George Floyd,They join a nationwide outpouring of rage and grief over the death of George Floyd a black man who died after a Minneapolis police officer was captured on ...
29/5/2020,Here And Now,In Wake Of George Floyd's Death Psychologist Reexamines ...,Protesters are trapped between police and other protesters who gathered in a call for justice for George Floyd following his death in Minneapolis Minnesota.
29/5/2020,KATV,Little Rock police chief 'angered and disgusted' by George Floyd's death,... the country on Friday Little Rock's police chief took to Facebook to address the police-involved death of George Floyd an unarmed black man in Minneapolis.
29/5/2020,,,
29/5/2020,Iowa City Press Citizen,Iowa City rally planned for Saturday in tribute to George Floyd,Iowa City activists will hold a rally at noon Saturday for George Floyd a black man who died Monday after a Minneapolis police officer held his knee on Floyd's ...
29/5/2020,Sahan Journal,As Asian Minnesotans call for justice for George Floyd some feel targeted for officer Thao’s role in death,As Asian Minnesotans call for justice for George Floyd some feel targeted for officer Thao's role in death. “A lot of the social media attacks have happened to ...
29/5/2020,WCCO | CBS Minnesota,Man Shot Dead In St. Paul; No Apparent Connection To George Floyd Riots,... there's nothing to indicate the shooting was related to the overnight unrest in the Twin Cities stemming from the death of George Floyd. Officers were called the ...
29/5/2020,Duluth News Tribune,Duluth NAACP invites public to light candle Friday for George Floyd; Enger Tower will be lit gold,Duluth NAACP invites public to light candle Friday for George Floyd; Enger Tower will be lit gold. The organization encourages discussions about the history of ...
29/5/2020,East Idaho News,Locals hold rally to protest the death of George Floyd,IDAHO FALLS — About 70 eastern Idahoans gathered on the Broadway Bridge in Idaho Falls on Friday to protest the killing of George Floyd. Floyd ...
29/5/2020,The Desert Sun,Valley police chiefs react to police in George Floyd video: 'I watched ... with absolute disgust',Two Coachella Valley police chiefs weighed in Friday on the death of George Floyd a Minnesota man who died after a police officer held a knee to his neck for ...
29/5/2020,Orlando Weekly,You can drop off letters donations for family of George Floyd at Saturday 'pull up' in Eatonville,On Saturday from 10 a.m. to 12 p.m. the Equal Ground Education Fund will host a drive-by letter drop off for George Floyd and his family called Pull Up for ...
29/5/2020,,,
29/5/2020,WEAR,Peaceful candlelight vigil held in Pensacola to honor George Floyd and Tymar Crawford,Currently the faces of two black men are featured on the bridge Minneapolis man George Floyd and Pensacola's Tymar Crawford -- both lost their lives at the ...
29/5/2020,The Coloradoan,Sheriff Smith on George Floyd killing video: 'Oh my god what in the hell is going on?',... and Larimer County law enforcement officials denounced the actions of an ex-Minneapolis police officer who was arrested Friday in the death of George Floyd ...
29/5/2020,KTVB.com,Idaho Black History Museum director speaks out on George Floyd's death local police and growing up black,After the recent death of George Floyd and the Minneapolis protests that followed Thompson sat down with KTVB's Brian Holmes to express his thoughts about ...
29/5/2020,The Ithaca Voice,Letter to the Editor: IPD Chief Dennis Nayor on George Floyd,George Floyd who died while being placed under arrest by officers of the Minneapolis Police Department. The viral video was utterly appalling and abhorrent to ...
29/5/2020,NBC Chicago,In Shift From Snarky Signs Wieners Circle Shares Message on George Floyd,But on Friday the restaurant's sign took a more serious tone echoing a pain being felt nationwide in wake of the death of George Floyd a handcuffed black man ...
29/5/2020,WBRC,Birmingham Police Chief on death George Floyd and importance of community relationships,Today as a former Minneapolis Police Officer is charged with 3rd degree murder for the death of George Floyd Chief Smith speaks out about Floyd's death and ...
29/5/2020,Wausau Daily Herald,Black Lives Matter protest gathers in Wausau in wake of death ...,WAUSAU - The anguish felt over the deaths of George Floyd in Minneapolis and other black Americans in recent memory manifested in Wausau as people ...
29/5/2020,Associated Press,Officer charged with George Floyd's death as protests flare,MINNEAPOLIS (AP) — The white Minneapolis police officer who pressed his knee into George Floyd's neck as he begged for air was arrested Friday and ...
29/5/2020,,,
29/5/2020,The Guardian,The death of George Floyd was an act of murder plain and simple,The death of George Floyd was an act of murder plain and simple. This article is more than 1 month old. The Minneapolis police department's failure to arrest ...
29/5/2020,USA TODAY,100 ways you can take action against racism right now,As protests continue over George Floyd's death and the continued mistreatment of Black Americans at the hands of police many are looking for ways to demand ...
29/5/2020,,,
29/5/2020,Minneapolis Star Tribune,OPINION EXCHANGE | George Floyd was a friend with a big ...,George Floyd was my friend. We met while I was making my rounds as a volunteer chaplain. The Salvation Army Harbor Lights is a regular stop on my route.
29/5/2020,Fox News,George Floyd family enlists Dr. Michael Baden to perform second autopsy,Reaction from Fox News contributor Ted Williams and Fox News senior judicial analyst Judge Andrew Napolitano. The family of George Floyd the Minneapolis ...
29/5/2020,,,
29/5/2020,Spectrum News,George Floyd Protest Event Planned for Saturday in Austin,AUSTIN Texas -- Coming on the heels of protests over the in-custody death of Houston native George Floyd Monday in Minneapolis Minnesota an event is ...
29/5/2020,Mpls.St.Paul Magazine,Artists Paint George Floyd Mural at Cup Foods,Artists Paint George Floyd Mural at Cup Foods. Xena Goldman Greta McLain and Cadex Herrera made the mural to give the community a place to mourn on 38th ...
29/5/2020,CNN,New video appears to show George Floyd being kneeled on by 3 officers,A new video posted on social media appears to show three Minneapolis Police Department officers kneeling on George Floyd during his arrest. Source: CNN ...
29/5/2020,CNN,Video shows moments before police pinned George Floyd to the ground,"George Floyd was pronounced dead after Minneapolis police officers restrained him while he repeated ""I can't breathe!"" All four officers involved have been ..."
29/5/2020,TIME,'These Protests Are the Community Grieving.' Activists Say Minneapolis Leaders Need to Make Drastic Changes After George Floyd's Murder,The death of George Floyd at the hands of a police officer felt like a “tipping point” Minneapolis community organizer Marjaan Sirdar tells TIME. Sirdar has lived ...
29/5/2020,The FADER,The Rap Report: To George Floyd a.k.a. Big Floyd of the legendary Screwed Up Click,George Floyd — the 46-year-old Black man who was suffocated to death when a white police officer planted a knee onto his neck earlier this week in Minnesota ...
29/5/2020,USA TODAY,Bear witness record de-escalate: How race may affect what bystanders are called to do in cases like George Floyd's,George Floyd a 46-year-old black man died Monday when a white Minneapolis police officer knelt on his neck for several minutes after he was detained.
29/5/2020,,,
29/5/2020,MinnPost,George Floyd protests are no 'primal scream'; they are the ...,May 29 2020. George Floyd was killed by a white police officer a mile north of my house in south Minneapolis. The protests that ensued marched north to the ...
29/5/2020,The New York Review of Books,After George Floyd a Nation in Search of Justice,In the three days since the horrific death in police custody of George Floyd an unarmed black man in broad daylight Minneapolis has been transformed almost ...
29/5/2020,INSIDER,Activists are begging people to stop posting George Floyd video - Insider,A video depicting a white Minneapolis police officer kneeling on George Floyd's neck before Floyd died in police custody went viral on social media. While many ...
29/5/2020,EMS1.com,EMS training liability lessons from George Floyd's death,Bystander duty of care: Off-duty EMS liability. What we can learn about EMS responsibility to intervene from the death of George Floyd. Jun 1 2020 ...
29/5/2020,ALXnow,Mayor Wilson: Alexandria Can Honor George Floyd By Fixing ...,As the country grapples with the death of George Floyd at the hands of four since-fired Minneapolis police officers and the fiery protests that have followed ...
29/5/2020,CBSSports.com,Stephen Jackson speaks at rally for George Floyd defends character of man he calls his 'twin',"Former NBA player Stephen Jackson stood in Minneapolis City Hall on Friday to speak at a rally for a man he considered a friend and his ""twin"" George Floyd."
29/5/2020,,,
29/5/2020,The Ledger,Aftershocks of George Floyds death hit Central Florida,George Floyd attended South Florida State College in Avon Park from 1993-1995 where he played basketball. Polk County law enforcement leaders outraged ...
29/5/2020,WUSA9.com,'The talk' | Killing of George Floyd leads to difficult family talks about racism,Following the killing of George Floyd at the hands of a police officer black families are once again having to speak with children about racism. This video file ...
29/5/2020,Madison.com,'Sickening and hurtful': Town hall on George Floyd death brings together black leaders police chiefs,Anger frustration and hurt were palpable at a virtual town hall meeting on Thursday addressing the death of George Floyd a 46-year-old black man who was ...
29/5/2020,Mitchell Hamline News,Deans student leaders call for justice in George Floyd killing – News and Events,“The Mitchell Hamline School of Law expresses deep sadness in the senseless killing of Mr. George Floyd. We stand in solidarity with those demanding swift ...
29/5/2020,Law.com,Pointing to George Floyd Death NY Defense Lawyers' Group ...,Pointing to George Floyd Death NY Defense Lawyers' Group Calls for 'Structural Work' in Legal System. “We know what we are seeing when we watch a police ...
29/5/2020,CBS Baltimore,George Floyd Death: Maryland Gov. Larry Hogan Says It’s Not Fair To Compare With Freddie Gray Case,BALTIMORE (WJZ) — The death of George Floyd in Minneapolis drew comparisons to the 2015 death of Freddie Gray in Baltimore but Maryland Gov.
29/5/2020,KSTP,Civil rights expert gives historical perspective on George Floyd protests,5 EYEWITNESS News spoke with a nationally known civil rights expert Friday about what to expect in the Twin Cities as the George Floyd protests stretched into ...
29/5/2020,City of Boulder,Boulder City Council Today Issued a Statement Condemning ...,Like so many community members we have watched the video of George Floyd's death during an encounter with police in Minneapolis Minnesota. We heard ...
29/5/2020,LAist,Mis Ángeles: George Floyd Should Be Home With His Family ...,It's apparent to me that Chauvin killed George Floyd and would not have faced justice had protests in Minneapolis and across the country forced Chauvin's arrest ...
29/5/2020,The Colorado Sun,George Floyd has revived a Colorado effort to change how ...,George Floyd has revived a Colorado effort to change how police-involved deaths are investigated. Stalled legislation born out of the fatal Colorado Springs police ...
29/5/2020,Chicago Tribune,George Floyd was once part of Houston hip-hop legend DJ Screw’s crew,A recording of him freestyle rapping over a typically sludgy Screw groove — working under the MC name Big Floyd — began circulating social media sites ...
29/5/2020,oregonlive.com,Portland NAACP hosts downtown demonstration in wake of George Floyd’s in-custody death (watch),George Floyd 46 was detained Monday because according to authorities he matched the description of someone who tried to pay with a counterfeit bill at a ...
29/5/2020,Wall Street Journal,The Minneapolis Neighborhood at the Center of Protests Over George Floyd’s Death,The Minneapolis Neighborhood at the Center of Protests Over George Floyd's Death. Longfellow residents begin process of cleaning up; 'It's sad to see this ...
29/5/2020,KNBR,Stephen Jackson calls for justice for lifelong friend George ...,“I'm here because they're not going to demean the character of George Floyd my twin” Jackson said. “A lot of times when the police do things that they know ...
29/5/2020,The Advocate,BRPD Mayor Broome address George Floyd's death: It's ...,A video of the encounter which has sparked outrage and protests across the nation shows an officer kneeling on the neck of 46-year-old George Floyd who ...
29/5/2020,Fox Baltimore,"""Deeply Horrific & Heartbreaking""|BPD Commissioner reacts to death of George Floyd",BALTIMORE Md. (WBFF) -- Police all over the nation have condemned the actions of Minneapolis police after George Floyd was killed while in custody as an ...
29/5/2020,The Southern,Carbondale leaders reflect on George Floyd killing in Minneapolis,CARBONDALE — When Father Joseph Brown saw the images of George Floyd a black man dying under the knee of a white Minneapolis police officer he was ...
29/5/2020,WECT,WPD Interim Chief Donny Williams addresses the death of ...,WPD Interim Chief Donny Williams addresses the death of George Floyd ... that the technique used by the Minneapolis police officer that led to Floyd's death is ...
29/5/2020,,,
29/5/2020,San Francisco Chronicle,Bay Area lawmakers were quick to call police killing of George Floyd ‘murder’,The officer who killed George Floyd must be arrested for murder.” Our country has a long history of slavery Jim Crow lynchings segregation and discrimination.
29/5/2020,Onward State,Community Members To Host 'Justice For George Floyd ...,State College community members including Penn State and State College Area High School students are planning a “Justice For George Floyd” protest at ...
29/5/2020,The Guardian,How the killing of George Floyd has upended America – video ...,Floyd pleaded that he 'could not breathe' and among his last words were 'don't kill me'. The incident has caused a reckoning over race and police killings of black ...
29/5/2020,LAist,'The World Is Messed Up:' One LA Neighborhood Reflects On ...,Jean Rucker believes that what happened to George Floyd in Minneapolis was terrible and that she wouldn't receive the same treatment as the officers if she'd ...
29/5/2020,West Central Tribune,Update: A memorial event for George Floyd held in St. Cloud,CLOUD — People started to drop off flowers at the Lake George Pavilion here Friday in remembrance of George Floyd who lost his life Monday while being ...
29/5/2020,Live 5 News WCSC,Georgetown Co. sheriff issues statement on death of George Floyd,The George Floyd incident brings other questions into play also. What was the probable cause for the arrest? Courts usually find probable cause when there is a ...
